{
  "nonce": "rcpt_test001",
  "product_id": "prod-001",
  "capability_id": "translate.multi@v2",
  "price_usd": 0.4,
  "latency_ms": 8100,
  "success": true,
  "channel_id": "ch_test001",
  "timestamp": "2026-07-25T20:44:29Z",
  "signature": {
    "algorithm": "ed25519",
    "value": "mh28j3EayiGqybO0lJDU7YB1sidGLX6fKnlpKieZWPpSaBWu3xzjCJnkcaLxQ+PL3bPgXbRVrJ1/HZhUnXTEDg=="
  }
}