{
  "nonce": "rcpt_test002",
  "product_id": "prod-001",
  "capability_id": "translate.multi@v2",
  "price_usd": 0.0,
  "latency_ms": 0,
  "success": false,
  "timestamp": "2026-08-28T09:00:50Z",
  "type": "rejection",
  "channel_id": "ch_test001",
  "reason": "verification_below_threshold",
  "verify_score": 0.41,
  "refunded": true,
  "trace_id": "tr_test002",
  "delivery_reasons": [
    "claim_unsupported"
  ],
  "signature": {
    "algorithm": "ed25519",
    "value": "3RMP8ENCYCAK48hX3lTiZaEXfaN10dGtuppPle3GUdzq/FkV9p1hhsaR4zgEEyqs6kpW3GEpG+mkZ8Kp0MN3Aw==",
    "version": 2
  }
}